Brachio: how library websites transform through time,"How have library websites changed over time?  What distinguishes them from their peers, and from their past?  What data might guide webmasters for maintenance decisions?  In this project, historical web code is collected and examined to highlight features and trends in library websites, back to the early days of the world wide web.  The cornerstone of this analysis is a dataset of about 1000 academic web URLs: homepages, content pages, and search engines.  This includes all members of the Association of Research Libraries (ARL) and several other prominent university libraries, compared with homepages from each library's host institution and those of a handful of prominent museums and public libraries.  Each URL is requested from the Internet Archive's Wayback Machine, in increments back to 1995.  HTML, CSS, JavaScript, and screenshots are collected, quantified, and evaluated against various metrics, including for complexity and accessibility, and parsed for hints of technologies used.  These page data are collected into a standardized snapshot of each webpage for cross-analysis, augmented with data from the ARL and the federal Integrated Postsecondary Education Data System (IPEDS).  With this dataset I am working to systematically highlight changes and trends in library websites, to help webmasters perform comparative research and to highlight differences in quality and equity.  It will enable answers to provocative questions like:
* how often are library websites rebuilt?
* what web technologies and features have been most popular among libraries?
* how do library websites differ between the Ivy League and smaller, regional institutions?

In time, I hope to provide a browseable catalog of library websites, for webmasters to make more informed decisions, and to enable further research into the history of libraries on the web."
Managing systems with care: What about the maintenance phase?,"How do we manage software with care? We live in a world where resources are scarce and new resource-intensive projects have the potential to take over a team’s workload. Balancing new projects alongside the day-to-day business of migrations, upgrades, and security fixes becomes a Herculean task.   The dedication and energy invested in the phases of the software life-cycle leading to a launch often leave little resources for the maintenance phase. This in spite of the fact that this phase is likely to be the longest and most labor-intensive over the course of a system’s life. How do libraries reconcile the excitement and dedication that goes into launching a system, with the less glamorous, but necessary maintenance of it thereafter? With administrators and patrons desiring new systems, how can we give proper care to those already in existence? What rewards do we give for the (sometimes) invisible labor that goes into sustaining these systems? In this presentation, we will talk about a generalized problem in library technology: how do we convey the value of the maintenance phase and how do we care for the systems we create?"
Caught between Clarity and Flexibility: How to Better Plan Development and IT Work,"If your IT team constantly receives more work than what it can complete given available resources, how do you plan and execute the work? Many IT teams face this challenge and find it difficult to come up with a satisfactory solution and processes. If a team plans more work than it can handle, team members will experience burnout and the quality of the work is likely to suffer. But simply tackling work as capacity frees up and avoiding planning will also run the risk of scope creep and poor resource management.  A certain degree of planning including a rough timeline and a set of deliverables seems essential to be able to provide the team with a goal to aim for and to evaluate how well or poorly the planned work was executed upon completion. But this is easier said than done, when the team has a large number of products to manage and many projects in queue. I will highlight key challenges we encounter when we try to better plan development and library technology work and discuss some measures and processes that can help balancing our conflicting desires for clarity and flexibility commonly found in IT teams."
Responsible AI: Building Tools and Frameworks for Transparent and Ethical AI Implementations,"Artificial intelligence (AI) can be used in libraries and archives as a powerful tool for enhancing metadata, improving search and discovery, recommending resources, powering library chatbots, and more. However, AI systems may incorporate surveillance technologies that threaten user privacy, and AI often reflects the biases of our society due to biased training data—for example, facial recognition technology is worse at recognizing the faces of people of color if training data is predominantly comprised of white faces. This talk discusses the early activities of the IMLS-funded Responsible AI project, which examines this tension between innovating library services and protecting library communities. The Responsible AI team will present key takeaways from an environmental scan of AI projects in libraries and archives, and our plans for an AI Harms Analysis tool that can ground AI software development and technology implementation. We’ll also discuss a call for case studies to illustrate ethical considerations and challenges during AI project or tool implementation. Attendees will learn about: the current state of AI implementation; how to think about AI transparency; and practical ideas for improving our services, while creating trust in our systems and mitigating the harms AI tools could inflict on our communities."
Transfer Library Data to Linked Art,"LUX (“light” from the Yale University’s Latin motto) is a multi-year project to find and connect
the Yale’s Cultural Heritage Collections across Yale University Art Gallery, Yale Center for
British Art, Yale Peabody Museum of Natural History and Yale University Library. LUX aggregates
metadata from the catalogs of Yale’s four main collections, over 50 million records—with a single
integrated search. How does Yale Library IT harmonize library data with archives and museum
metadata as Linked Open Data? The poster will demo the process of converting ArchivesSpace data
and ILS MARC data to Linked Art JSON_LD by implementing a flexible model in a Java Spring-based
application with Postgres. The application expresses library data as Linked Art entities and
exposes data through an Activity Stream. Transforming the library data at large scale into Linked
Data is challenging, especially in terms of data schema design and data storage. We will share the
lessons we learned from this project and also explore an alternative we are working on for data
delivery to LUX."
Thor: For the Love of Metadata,"Are you tired of building one-off scripts to process your data? Does copying and pasting snippets of code to patch together yet another script make you want to scream? Well, have I got news for you! Introducing: Thor. No, not the Hemsworth with the hammer; the gem worth its weight in empowering you to build and organize reusable metadata processes.  In this presentation I'll demonstrate what Thor, the flexible command line interface toolkit, has to offer to make your next metadata project a breeze*.


\* or at least less of a headache."
"It’s Electric! (How to boogie with a soldering iron, safely)","Do you know Python, C, and Ruby, but don’t know the difference between a transistor and a resistor? Have you ever wanted to create custom electronics for your library or be able to help patrons that want to? Has your library been looking for a way to engage in STEAM activities? Do you know the difference between a breadboard and a cutting board? We’ve got a session for you!   This workshop is open to 20 people as a novice workshop with no previous knowledge required.   Attendees will build a working knowledge of electricity and put it into practice by learning a tactile skill, soldering. We’ll be covering simple electronics, what is needed to design a circuit, and how to assemble and solder a simple electronic circuit board. Using Autodesk TinkerCAD circuits we will be covering basic electronics, simple circuitry, and digital breadboarding. Then we’ll also cover how circuits are turned into printed circuit boards(PCBs) using easyEDA. Both programs are free-to-use web-based programs.   Finally, we will be practicing soldering by assembling a wearable printed circuit board you can wear for the rest of the conference as a physical credential of your success."
Code4AI,"Artificial intelligence (AI) is everywhere, and its applications are part of our daily lives; More and more Libraries do machine learning too!  A Computer Science instructor and a certificated TensorFlow developer will lead this three-hour workshop. Participants will first learn the fundamental knowledge of machine learning and some AI use cases and applications. The second part of the workshop will introduce TensorFlow. Participants will learn how to build a neural network, train, evaluate and optimize machine learning models, and use built models to predict new data.  No complicated algorithms or math. Just do coding! All are welcome."
Building a community of practice around library data,"Data systems are used throughout libraries to support a variety of needs, including external reporting, decision making for resource allocation and library service design, discovery and access, and traffic monitoring. As libraries increasingly rely on data systems for everyday work across divisions and departments, an increasingly broad group of library staff needs to build skills with using these systems. This presentation will share an early attempt to build a community of practice around library data among staff at a large academic library. The community is supported by a Microsoft Teams space, and biweekly meetings allow the community to meet and discuss topics of interest. Early meetings have focused on specific training topics, including Git/GitHub, SQL, and Python. The presentation will include details about establishing and maintaining the community, as well as early lessons learned."
Developing Scripts to Scale Out Open Access E-book Acquisitions at the Library of Congress,"The Digital Content Management section (DCM) of the Library of Congress (LC) has incrementally improved upon piloted workflows to identify, describe, process, preserve, and make accessible open access e-books to Library users. In 2018 and 2019, DCM staff led several pilot projects to test technical methods for obtaining e-books from various sources, transforming descriptive metadata, adding rights metadata, and processing the content for presentation on loc.gov. In 2022, DCM staff worked to meet a recent LC-objective to “Routinize processes for acquiring and making available open access & openly available e-books”. This effort focused on the routinization of acquisition of titles from the Directory of Open Access Books (DOAB), which offers over 61,000 open access titles. Scalable data processing methods were required for routinizing content acquisition and processing workflows for e-books from DOAB resulting in the development of 11 new Python scripts, which identified eligible titles for inclusion in the Library's permanent collection, sorted titles into queues by type of required processing work, and acquired content and representative images at scale, and preserving and providing access to an additional 1700 open access e-books. This presentation will highlight the workflow development and refinement, challenges, and next steps for repeating this now-routinized work."
Creating Visual Essays with Juncture,"The proposed workshop will consist of:

1) A general overview and demo of Juncture (https://beta.juncture-digital.org). Juncture is tool for digital storytelling, consisting of a set of open and free web-based services that enable non-technical users to quickly create engaging visual essays. The new version of Juncture will include web-based authoring tools in addition to the visual essay rendering engine provided in the first version. A Juncture essay includes interactive images, maps, video, and other visualizations connected to a text narrative. A Juncture essay is defined using plain text augmented with simple tags for formatting and declaring visualizations in a rendered web page. Much of the essay authoring can be performed using drag-and-drop interactions.

2) A live-coding segment in which participants are invited to create their own visual essay. The essays created will include IIIF images, interactive maps with overlays, and text-tagging to enable interactions between essay text and images/maps.

3) A walk-through of the process for setting up a personal media repository for managing and sharing IIIF images. In this segment users can follow along to create their own media repository, add some images (from phone or computer) and use images in their visual essay.

4) An overview/demo of how to configure multiple Juncture essays into a website with a custom domain

5) Using Juncture visualizations in a Wordpress site or vanilla web pages"
Doing it for the Photogrammetry: 3D modeling in the classroom,"This poster will provide an overview of a photogrammetry assignment developed as part of an
Introduction to Digital Humanities class. This session was a partnership between Special
Collections and Digital Initiatives librarians and allowed students to experiment with 3D modeling
artifacts housed in special collections. Students used their phones and 3D Zephyr to photograph
and process their models which were then uploaded to Sketchfab. Students received hands-on
experience working with the artifacts and transferable digital skills that are part of
professional cultural heritage institutions’s digital practices. Students also had the opportunity
to partner with special collections collaborators such as The Byron Society of America to envision
ways of making their realia collections more public-facing and accessible. This activity was part
of the course’s image and archives unit and also helped make explicit themes and theories explored
within the class related to close looking, the uncanny, and digital preservation."
Thinking outside the box: Distributed architecture to meet new challenges for openly published research data,"Princeton University Library is performing software and data migration along with rapid
technological development with the goal of making sustainable, robust software to support our
digital repository service and to address the emerging needs of research data today and in the
future. Traditionally, options for this type of work include “boxed” systems that have
interdependent components for object storage, description, presentation, and preservation. These
systems often lack the flexibility to support emerging metadata standards, or to integrate with
other infrastructures, and tend to have brittle, extremely time-costly upgrade processes that can
result in data loss. This poster will cover our approach for supporting openly published research
data with our newly-developed software, as well as our efficient, flexible approach to creating an
ecosystem of services capable of being extended to connect with campus partners at Princeton and
beyond. In presenting our institution’s solution and future plans, we hope to generate a rich
discussion with others sharing these common problems in support of digital repositories."
Controlled Digital Lending...What's the Fuss?,"Controlled Digital Lending, or CDL, is the replication of the physical act of checking out a book brought to the digital space. One book, one lend—no matter if the book is a physical one or a digital one. Using digital rights management to enforce the one-book/one-lend policy, CDL extends the reach of items that the library has purchased to patrons outside of the four walls of the building.  Behind this simple idea is complex web of policy and technical decisions. To say nothing about the risk of being sued. This session explores the policy, technology, and yes a little of the legal space surrounding CDL. Attendees will learn about CDL projects in libraries, Project ReShare's effort to add a CDL app to its platform, and the efforts of the NISO working group on Interoperable System of Controlled Digital Lending."
Programmatically Assisted Approaches to Improving Digital Collections Metadata,"Our homegrown digital collections infrastructure and changing practices have made it difficult to keep our metadata up-to-date in a systematic way, especially for older collections. We’ve been piloting workflows for two of our collections from the early 2000s, to use programmatic methods to help identify areas for additional human intervention. The first is for a collection of materials primarily from the Philippines during the era of US occupation, which is heavily used in the Philippines. Improving the metadata to increase usability for this collection has been part of our institution’s work grappling with its legacy of colonial involvement and responsibility to provide access for communities from whom materials were taken. The second is for a bibliographic collection of 19th century US history, where we know some items are pulling metadata from the incorrect catalog record, but we don’t have a complete list of what items should be in the collection. Both collections have thousands of items, and due to their topic and time of publication, contain sensitive content that require additional care and contextualization, which is why we took an approach that uses automation to facilitate rather than replace human intervention."
Automating FAST Subject Heading Maintenance in Digital Repositories,"Digital repository metadata requires ongoing maintenance beyond the initial creation phase to ensure its quality in the long run. This is particularly true for subject headings because they change over time due to evolving usage and, more recently, to address diversity, equity, and inclusion (DEI) issues. Since most repositories use non-MARC metadata standards, subject maintenance may necessitate manual checking of change logs published by vocabulary maintenance agencies rather than relying on services from MARC-based authority processing vendors. These periodic checks and subsequent maintenance works are tedious and time-consuming. Recent DEI related changes to subject headings gave Michigan State University Libraires (MSUL) repository team an opportunity to address subject maintenance in a more systematic way and develop an automated FAST subject maintenance workflow. Harnessing URIs stored in MODS records, this workflow utilizes OAI-PMH, OCLC FAST Linked Data API, and XSLT to identify obsolete and changed FAST subject headings used in the repository and update relevant MODS records with the new headings accordingly. This presentation will discuss the mechanics of the process, steps taken to ensure its accuracy, and some unintended benefits."
Breaking into Prison: Bringing Library Resources to Incarcerated Learners,"More than one hundred thousand college students in the US are currently incarcerated, and that number could more than double by the end of next year. Some of these students have never visited a library, and some will never be able to. Can technology help get these students access to academic library resources, and if so, how?   Students, teachers, and administrators in carceral settings have unique needs. Those needs can include both resource constraints like dated hardware or lack of internet access and security constraints like potentially dangerous content or access to communication tools. This talk will share the work of the JSTOR Access in Prisons Initiative, which aims to provide free JSTOR access to incarcerated learners. I’ll address the ways we work through and around the restrictions of carceral institutions. While I’ll share some of the tools and technologies we’re using to do that from Kubernetes in the cloud to Elasticsearch on a thumbdrive, I’ll focus more on the ways that no single set of tools can meet the strange conglomeration of needs we’re trying to address."
OCFL-Index: an API for accessing OCFL repositories,"[OCFL-index](https://github.com/srerickson/ocfl-index) is a project to define and implement a
lightweight http/gRPC-based API for indexing and accessing the contents of OCFL-based repositories.
It can serve content from OCFL storage roots on the local file system or in the cloud. The index
is implemented as a sqlite3 database, however additional database backends are planned. The API is
implemented in Go and client libraries for a variety of programming languages can be auto-generated
using protocol buffer service definitions.  This poster provides an overview of the current project
status, including its goals, design decisions, and recent benchmarks."
"How to Rebuild a Jumbo Jet at 30,000 Feet: Strategies for Digital Library Migration","In support of research, teaching and learning, the Stanford Digital Repository (SDR) is a network of systems and services that house the digital collections of Stanford University Libraries (SUL). Collections in SDR include Google-scanned books, student dissertations and theses, University Archives, Allen Ginsberg's papers, Parker Library, and the Fugitive U.S. Agencies Web Archive, to name a handful. As of late 2022, SDR holds over 5 million digital objects composed of more than 530 million content files. SDR is extremely heterogeneous along several facets, including content types (e.g., books, images, web archives, GIS datasets) and file types.  For the past 4 years, SUL has been working towards migrating SDR to a new datastore and data model. We successfully completed the migration this year. In this presentation, we will describe the motivations for this work and the strategies used to accomplish the migration. These strategies may be repurposeable in other production system migrations: adopting a validatable data model, abstracting the datastore behind an API, separating concerns, testing metadata mappings against production, writing reports to understand complex data, templating unit tests, performing a rolling migration, and incorporating migration into ongoing project work."
Dr. Lydia Tang Keynote,"Dr. Lydia Tang is an Outreach and Engagement Coordinator for LYRASIS. Previously, she
held archivist positions at Michigan State University, the Library of Congress, and numerous
graduate positions at the University of Illinois, where she received her MLIS and Doctor of Musical
Arts degree. Passionate about accessibility and disability representation in archives, she served
on the Task Force to Revise the Best Practices on Accessible Archives for People with Disabilities
and spearheaded founding the Society of American Archivists’ (SAA) Accessibility & Disability
Section (ADS). She is the 2020 recipient of SAA’s [Mark A. Greene Emerging Leader
Award](https://www2.archivists.org/news/2020/mark-a-greene-emerging-leader-award-lydia-tang) and
was recognized in three SAA Council resolutions as a co-founder of the Archival Workers Emergency
Fund, for spearheading the Accessibility & Disability Section’s “Archivists at Home” document, and
for the “Guidelines for Accessible Archives for People with Disabilities.” In addition to her
professional service with SAA, she has contributed to accessibility initiatives within DLF Digital
Accessibility Working Group and the ArchivesSpace open source software community by leading the
Staff Interface Enhancement Working Group, Development Prioritization subteam, founding the
Usability subteam, and chairing the Users Advisory Council. She has written about accessible
physical archival spaces, hiring and advancement practices, and is currently co-editing a book
with Dr. Gracen Brilmeyer, Preserving Disability: Disability and the Archival Profession."
"The Oxford Common File Layout - Understanding the specification, institutional use cases and implementations","The Oxford Common File Layout (OCFL) is an emerging data standard that describes an application-independent approach to the storage of digital information in a structured, transparent and predictable manner. With the most recent release, v1.1, OCFL implementations are becoming increasingly popular within institutions looking for long-term preservation solutions that are robust against corruption, offer storage diversity and are easily transportable between storage vendors, thus protecting their content into the foreseeable future.  In this presentation we will discuss the specific design goals and methodologies involved in developing and maintaining the OCFL specification as well as explore different ways institutions are implementing OCFL as part of their digital preservation programs. Implementers will speak about their use case requirements for their individual institutions and reasoning behind selecting OCFL as well as discuss their desired outcomes."
