Dr. Siobahn Day Grady Keynote,"Dr. Siobahn Grady is an Assistant Professor of Library and Information Sciences and the director
of the [Laboratory for Artificial Intelligence and Equity Research
(LAIER)](https://www.nccu.edu/slis/laboratory-artificial-intelligence-and-equity-research-laier)
at North Carolina Central University, the only ALA-Accredited Library School at an HBCU
(Historically Black College or University). Dr. Grady's research is focused on using machine
learning to identify sources of misinformation on social media, and on improving fault detection in
autonomous vehicles. Dr. Grady is an IF/THEN Ambassador for the American Association for the
Advancement of Science, a program which seeks to bring more women and minorities into hard
sciences, technology, engineering and mathematics. Dr. Grady was the first woman to graduate with
a computer science Ph.D. from N.C. A&T State University, and through her teaching, research,
philanthropy and public speaking she is a passionate supporter of HBCUs and the students they
serve. Code4Lib would benefit from learning about her work at LAIER and about her vision for
minority girls' and women's futures in technology fields.

More Information about Dr. Grady Can be found at [her website](https://siobahncday.com/)."
"There’s going to be some changes: Developing support, supporting developers, and supporting development.","When faced with a wide range of upgrade-related changes to our digital preservation system, the library’s Digital Preservation Unit was charged with supporting stakeholders with varying needs through the transition. What from the outset seemed to be a straight-forward task of creating documentation and informing users, quickly expanded to include extensive testing, providing support to the developers of various integrations, and developing new user-facing software ourselves. This presentation will provide a number of lessons-learned along the path from getting up-to-speed with a large number of system changes, finding our edge-cases as early as possible, working with internal and external developers, the development of our packaging application and the technology choices that enabled it."
Weill Cornell Institutional Data Repository for Research (WIDRR),"A new National Institutes of Health (NIH) data management and sharing policy requires funded
investigators to share appropriate research data according to FAIR principles (Findable,
Accessible, Interoperable, Reusable), and is effective in January 2023. In response, Weill Cornell
Medicine (WCM) Wood Library has developed a new tool named WIDRR – WCM Institutional Data
Repository for Research - aimed at helping WCM researchers deposit their datasets in a local
repository, so they are findable. WIDRR is used to deposit datasets for three milestones:
1) whenever a researcher publishes a paper, 2) when a researcher’s grant ends, or 3) when a
Principal Investigator leaves the institution. The tool is built with Django web framework and
based on a relational PostgreSQL database. It includes a 4-step wizard walking researchers through
the deposit process. This tool is connected to the WCM Data Catalog and allows researchers to
create a data catalog entry as they deposit (archive) their dataset. The data catalog entry
displays the metadata associated with the dataset, allowing each dataset to be visible by the
whole WCM community, thereby fostering the reuse of these datasets. This poster illustrates the
infrastructure and workflow which enable WCM researchers to meet this new policy requirement."
Metadata for everyone: Identifying metadata quality issues across cultures,"Metadata is crucial to the dissemination and communication of research. Well-formed metadata facilitates discovery and access and provides contextual, technical, and administrative information in a standard form. Yet metadata are also sites of tension between sociocultural representations, resource constraints, and standardized systems. Formal and informal interventions in metadata spaces may be interpreted as metadata quality issues, political acts to assert identity, or strategic curatorial choices to maximize discoverability and visibility.  In this context, we engaged with Crossref on the Metadata for Everyone project to understand how metadata quality, consistency, and completeness impact individuals and communities. Working from a sample of records known to have erroneous, incomplete, or otherwise imperfect metadata, this project set out to identify and classify the issues stemming from how metadata and communities press up against each other to intentionally reflect (or not) cultural meanings. Beginning with an overview of the context and our qualitative approach, this presentation will go on to provide an overview of the various metadata quality issues we identified and the typology we developed to better understand them. We conclude by discussing the implications of our findings and describing future work we intend to undertake."
A Dashboard Might Help Maintenance for Your Backend Service,"We have a complex backend API service with a team responsible for maintenance.  Different errors occur in this service and even though there is documentation, the team struggles to address the problems due to service complexity.  This is an organizational vulnerability smell.  With some team brainstorming, the idea of a dashboard surfaced – something to show the current health status of the service … and a way to associate specific current problems with the appropriate documentation and tools to address said problems.  A dashboard prototype surfaced additional desires for information demand, from “tell me about this object” to “I want stats for the last 6 months.”  An interesting bonus:  the initial implementation of the dashboard surfaced a data problem not caught at runtime or by our regularly run audits."
Documenting Movements: Mukurtu as a platform for contemporary video archive,"Mukurtu was designed for Indigenous communities to determine and enact cultural protocols in a digital space by managing the access and use of cultural materials and knowledge. What about for political action that Indigenous communities are engaged in and documenting right now? This presentation will showcase a partnership between an academic institution and an Indigenous legal advocacy organization to create a portal for students and researchers to their video archive featuring documentation of environmental justice movements. Considerations include privacy and surveillance, ease of use for different purposes by stakeholders including students at tribal colleges, accessibility, and content governance. We will share the limitations for using Mukurtu for such a project and different technical models that projects can use for self-hosting or cloud hosting video content."
Worst Case Scenario Turns Out Better Than Expected - The National Library of Wales’ Fedora Migration Story,"As with many institutions using older versions of Fedora, the National Library of Wales has long been plagued with the challenge of upgrading an outdated and unsupported Fedora 3 repository. After unsuccessfully attempting to migrate to Fedora 4, the need for securing a long-term preservation strategy to protect the 5.5 million objects in the repository was critical. In early 2022, the Library sought to contract the Fedora Program Team to facilitate a migration to Fedora 6. With promising news of Fedora 6.x offering updated preservation standards, transparent data and accessible migration paths, it was imperative to begin a migration to preserve this content.  With deeper investigation into the tools available as a result of the IMLS Fedora Migration Paths & Tools Project Grant, the Library team realized that the community-developed tools and documentation were comprehensive enough to execuse the task in-house; saving costs and providing user experience back to the community.  This presentation will discuss the Library’s migration pathway - from the decision making process to move to Fedora 6.x, to planning the migration and finally executing the work. We will share lessons learned, challenges and successes encountered during the migration and finally plans for the road ahead."
Improving Readability and Tracking of LC Classification Number Updates with Python,"Every month, the Library of Congress releases changes and additions to LC classification numbers
published to classweb.org/approved/. Most recently, the Library of Congress has begun releasing
changed classification patterns for outdated and/or harmful racial and ethnic group terms. NCSU
Libraries has an interest in tracking and implementing these changes locally. We explored how to
process these monthly lists using Python to filter the monthly results into a more readable
spreadsheet for us to review and implement changes as they appear. Using regular expressions, HTTP
requests, and Pandas, we successfully created a script that exports these lists into a multi-tab
spreadsheet for users to track and execute all applicable changes in a more readable, easy to use
format."
"Duplicates in the repository: remediation and reconciliation in three systems, including DataCite","Academic Commons provides long-term open access to digital scholarships produced by Columbia
University affiliates. Content may be added by authors through a self-deposit form, by library
staff through the cataloging backend (Hyacinth), and via SWORD deposit from entities such as
library-hosted OJS, journal publishers, and others. As one might expect, after fifteen years of
additions through these various channels, duplication happens! When faced with a corpus of nearly
40,000 records that must be reviewed, with duplicates remediated in three separate systems, how
does one even start? This poster illustrates our approach to defining and scoping this problem, as
well as the project workflows and technical solutions we utilized to remediate approximately 300
duplicate item records and 600 associated asset records.

Technologies: Fedora, Solr, Rails, Python, DataCite"
Days of Future Past: Examing Race through Comics Metadata,"This panel uses the Comics as Data North America (CaDNA) dataset at Michigan State University to discuss patterns of racial depiction in North American comics from 1890-2018. After three brief case studies, we demonstrate how CaDNA visualizations highlight representations of race in North American comics, alongside how metadata can be used to codify, correct, or disrupt authorial representation in linked open data.   This panel draws on metadata from the Michigan State University Comic Art collection to explore the ways we codify and describe identity. We call attention to the constructed nature of race in North America and the continuing work needed to imagine race beyond the confines of the established cultural legacy."
The challenges and opportunities of interdisciplinary collaboration to build custom software tools at a growing archive,"Archives are confronted with an increasing number of data processing challenges for which there are not often user-friendly or affordable software solutions. In addition, traditional  education and training in the field of galleries, libraries, archives, and museums (GLAM) have left practicing professionals with a growing gap in the skills required to meet contemporary preservation needs. In this presentation, a programmer and an archives professional will detail their unique experience collaborating to build and utilize custom data processing tools to demonstrate the considerations, challenges, and benefits of working on interdisciplinary teams to produce custom, in-house software solutions at a GLAM institution. Emphasis is placed on the synergistic outcomes and professional development that communication and collaboration between programmers and GLAM professionals can produce."
DLAS: UX/UI design considerations for enslavement websites,The Digital Library on American Slavery (DLAS) is an expanding resource consisting of over 35 thousand public records on race and enslavement in the American South.  The presentation will begin with a brief introduction to the [DLAS website](https://dlas.uncg.edu/).  The presentation then highlights the different UX/UI design considerations made throughout the web development process.  This presentation will offer attendees best practices when working with enslavement records.
Painting A Bigger Picture: Creating Adaptable Application Profiles based in Sinopia,"LD4P’s Sinopia Linked Data Environment has become a valuable resource for creating RDA/RDF encoded
metadata, but just as sinopias were precursors to fully-fledged frescoes, the Sinopia Environment
is only an introduction to what is possible for linked data in library science. The University of
Washington Library’s Linked Data team has been developing a workflow to create Sinopia resource
templates outside of the Sinopia interface using XML and Python. The Sinopia MAPs project stores
the data necessary to create these resource templates in a GitHub repository, creating a single
source that can be used to produce multiple derivatives including Sinopia resource templates,
human-readable HTML templates, and potentially other representations, such as DC Tabular
Application Profiles in the form of CSV files. By using a workflow outside of Sinopia, property
templates can be referenced and reused across multiple application profiles, meaning a single line
of code can create a whole new resource template. This project is an exploration in designing
platform-agnostic metadata application profiles that can be easily adapted and used to create
templates in a variety of formats to support the production of resource descriptions in RDA/RDF."
"Foster, Connect, Support: A 2-year reflection as Senior Program Officer for the Open Library Foundation","The Open Library Foundation is a non-profit organization that seeks to enable and support
collaboration among library workers, technologists, and service providers in order to share
expertise and resources for the creation of innovative software and resources that support
libraries. This poster will reflect on my two-year term as the Senior Program Officer for the Open
Library Foundation. It will highlight common themes across Foundation project communities, provide
a look inside open source governance, and discuss the benefits of volunteer opportunities such as
this one within open source projects."
International Image Interoperability Framework (IIIF) infrastructure redesign at Harvard Library,"The Library Technology Services (LTS) team at Harvard University has completed designing, building, and implementing the next-generation image delivery infrastructure for the Harvard Library. This infrastructure is largely based on standards and technologies compatible with the International Image Interoperability Framework (IIIF). LTS maintains the IIIF infrastructure for delivering images and metadata to Harvard Library platforms such as HOLLIS (the Harvard Library catalog) and Harvard Digital Collections (public access to more than 6 million objects). The IIIF environment is also used by the Harvard Art Museums, HUIT Academic Technology (with integration into Canvas) and Vice Provost for Advances in Learning (VPAL), and is considered critical university-wide infrastructure for teaching and research.  Members of LTS will host a series of presentations and demonstrations to showcase the recent work on the IIIF implementation project. Engineers will explain the architecture principles guiding the designs and show the technical plans and system architecture diagrams. A full walkthrough of the entire asset ingest and delivery workflow will be shown with recorded demos."
Assessing open source and subscription data sources for research information management and evaluation,"Academic libraries are increasingly called upon to capture and use publication metadata to
demonstrate the productivity and impact of the institution's researchers. But not all data sources
are created equal. This poster will describe a case study involving a research impact assessment
using four metadata sources, including two open source and two subscription based solutions. It
will compare the different data sources, assessing the benefits and drawbacks of each, and the
impact of data source selection on the results of a research impact assessment project."
"Slower, but Worth It: Navigating a Systems Migration via RFCs","This poster will outline takeaways and lessons learned from using a Request for Comments (RFC)
process for collaboratively managing a large digital collections migration project. RFCs are a
transparent, participatory approach to change management that is frequently used in open source
software projects to encourage dialogue among community stakeholders with widely differing
perspectives and areas of expertise. Using this structured communication method has provided an
effective tool for our Libraries' cross-departmental project team as we work through a migration
of more than 1.8 million digital resources, representing nearly twenty years of mass digitization
and boutique projects, from a self-hosted CONTENTdm platform to our custom Fedora-based Digital
Collections Repository. In this poster session, we will share tips for other teams who may be
interested in using RFCs for encouraging collaboration to solve problems that are beyond the scope
of any single department. We will highlight recommendations from our team's experiences with
adapting an RFC template and review process to facilitate collaboration by software development,
metadata, and digital collections staff. We will also provide examples of using RFCs to explore
and define requirements and implementation objectives for intersecting systems, workflows, data
stores, and services."
Getting running with ARK persistable identifiers,"In this 3-hour workshop we will introduce you to ARKs (Archival Resource Keys), which can serve as persistent identifiers, or stable, trusted references for information objects (eg, web addresses that don’t return 404 Page Not Found errors). For more than two decades, 8.2 billion ARKs have been created by over 1000 organizations — libraries, data centers, archives, museums, publishers, government agencies, and vendors.  We will cover:
* Why ARKs -- non-paywalled, decentralized, flexible
* Use cases -- Smithsonian, French National Library, Internet Archive
* Metadata for early and ongoing object development
* How to get started -- one form
* Minting and assigning ARK identifiers
* Resolvers, resolution, redirection
* Object types -- digital, physical, conceptual
* Persistence considerations
* Available tools"
HathiTrust Research Center Extracted Features API and Visualization Workshop,"The HathiTrust Research Center (HTRC) Extracted Features is a derived dataset consisting of volume metadata and word-level statistical data (aggregated at the page level) that has been extracted from content in the HathiTrust Digital Library. It is presented as JSON-LD files representing a snapshot of the HathiTrust corpus from February 2020. As part of an NEH-funded project, “Tools for Open Research and Computation with HathiTrust: Leveraging Intelligent Text Extraction (TORCHLITE),” the HTRC team is building a new API and interactive dashboard to allow our user community to develop its own tools for interacting with data from the 17.5 million-volume HathiTrust Digital Library. This workshop will provide an introduction to the Extracted Features dataset and the new TORCHLITE API, and set the stage for an NEH-funded hackathon in Fall 2023. There will be a hands-on portion of the workshop. Beginners with little to no coding experience can follow along as we use interactive code notebooks to create visualizations using Extracted Features. More advanced users can write their own code to interact with the data."
Building Effective Library Dashboards in Tableau,"The Collection Strategies Division of Columbia University Libraries is using Tableau to develop
a series of dashboards and tools in order to more efficiently and effectively track important
data across collections. These dashboards will provide deeper insight into how library collections
are being utilized and allow staff to make data-informed decisions regarding both existing
collections and potential acquisitions. This talk will discuss the development and design of the
dashboards, workflow implementation, data collection and integration processes, and the various
challenges encountered. It will also include a demonstration of sample dashboards."
Test-Driven Data Migration,"At Princeton University Library, we are migrating research data collections from a legacy DSpace instance to our newly constructed Princeton Data Commons suite of applications. This includes migrating metadata from modified Dublin Core to DataCite. Our goal is to improve the discovery and reuse of our open research data.  We are using a technique we like to call test-driven data migration. By leveraging strategies from test-driven development, we surface the origins of inconsistent metadata and build a virtuous cycle between metadata creation and use. We create artifacts we can use to engage in iterative feedback loops with our stakeholders and with the broader research data ecosystem.  This involves identifying representative samples from the collection that is to be migrated and writing Rspec system tests that simulate a cataloger using our newly developed DataCite cataloging interface. We then validate both the cataloging process and the resultant record with stakeholders. We also incorporate the record into other software development value streams.  This presentation will show our new cataloging interface and some of the tests we are using, and we will discuss how writing our tests first improved the overall migration process."
Modern Alchemy: Hands-On with the Distant Reader,"In this hands-on workshop participants will first learn how to use a system called the Distant Reader to transform sets of unstructured data (like journal articles) into structured data affectionally called ""study carrels"". These data sets are amenable to analysis by both people as well as computers. Second, participants will learn how to use a Python-based command-line tool (the Reader Toolbox) to apply text mining and natural language processing tasks against the structured data. These processess include things such as feature extraction, concordancing, topic modeling, full text indexing, semantic indexing, network analysis, etc. In the end, participants will learn of an additional way to turn data into information -- modern alchemy."
AMPlifying AV: leveraging artificial intelligence to create metadata for audiovisual collections,"In 2015, Indiana University (IU) undertook a massive project to digitize audio, video, and film assets that resulted in over 350,000 digitized items, including collections from the Moving Image Archive, the Black Film Center & Archive, the Archives of Traditional Music, and many other campus units. Significant portions of this content lack descriptive metadata and contain unknown content. Since 2018, the IU Libraries have been working with partners at AVP, the University of Texas at Austin, and New York Public Library, supported by the Andrew W. Mellon Foundation, to develop the open source Audiovisual Metadata Platform (AMP). The vision of AMP is to allow archivists and librarians to create workflows leveraging artificial intelligence and machine learning services to help generate metadata supporting identification, discovery, and rights determination for these collections. These workflows include tools that perform tasks such as speech-to-text, named entity recognition, applause detection, and facial recognition.  This talk will share findings from our evaluation of these AI/ML tools and their effectiveness in creating metadata for audiovisual collections at IU. We’ll also cover the context for the larger AMP project, provide a brief demo, review the open source technology stack, and explore next steps for the project."
Utilizing R and Python for Institutional Repository Daily Jobs,"In recent years, the programming languages R and Python have become very popular among data
scientists. However, R and Python are not just for data scientists or programmers, they can also
help librarians to perform many tasks more efficiently and possibly achieve goals that were almost
impossible before. R and Python are scripting languages meaning they not very complicated. With
minimal programming experience, a librarian can learn how to program in these languages and start
to apply them to jobs. This article gives examples of utilizing R and Python to clean up metadata,
match transcripts with scanned images, and resize images for the Colorado State University
Institutional Repository."
{key: value} : algorithmic debiasing in practice,"Algorithmic bias is familiar to many of us by now. Like, probably, you, I’ve read papers and watched talks on it for years now. And yet, when I sat down to code an interface that relied on machine learning, I realized I had plenty of questions – but no answers. As much as I’d learned about the big picture, I had no idea how to translate my values into the next line of code. When I looked for literature, I found lots of context, but nothing like a code sample. And yet, I still had decisions to make about interaction elements like autocomplete, or image display, or data visualization. How do I get from context to code? How do I implement these values?   In this talk, I’ll describe specific situations I faced, and the concrete questions of interface design they raised for me. I’ll ask a lot of questions. Perhaps you will have some of the answers."
